{
  "schemaVersion": 2,
  "renderLoopRevision": "v1-generic-structural",
  "id": "siroino-telescope-cuff-tailor-set",
  "productName": "Telescope Cuff Tailor Set",
  "adapterId": "siroino-v1.0",
  "productRoot": "Assets/GenWorks/siroino-telescope-cuff-tailor-set",
  "productManifestPath": "Assets/GenWorks/siroino-telescope-cuff-tailor-set/ProductManifest.json",
  "buildScript": "tools/run_product_build.py",
  "productBuildScript": "tools/generic_structural_garment_product.py",
  "hostedPoseScript": "tools/siroino_required_pose_render_entry.py",
  "blendPath": "Assets/GenWorks/siroino-telescope-cuff-tailor-set/Source/Blender/TelescopeCuffTailorSet.blend",
  "fbxAssetPath": "Assets/GenWorks/siroino-telescope-cuff-tailor-set/Models/TelescopeCuffTailorSet.fbx",
  "prefabAssetPath": "Assets/GenWorks/siroino-telescope-cuff-tailor-set/Prefab/TelescopeCuffTailorSet.prefab",
  "integratedPrefabAssetPath": "Assets/GenWorks/siroino-telescope-cuff-tailor-set/Prefab/SiroinoSotai_TelescopeCuffTailorSet.prefab",
  "targetAvatarAssetPath": "Assets/SiroinoWorks/SiroinoSotai/Prefab/SiroinoSotai_PC.prefab",
  "targetSourcePath": "Assets/SiroinoWorks/SiroinoSotai/FBX/SiroinoSotai_PC.fbx",
  "licenseEvidence": "config/products/siroino-telescope-cuff-tailor-set/license.json",
  "privateSourceRoots": ["Assets/_Local", "Assets/_Vendor", "Assets/SiroinoWorks"],
  "deliveryAssets": [
    "Assets/GenWorks/siroino-telescope-cuff-tailor-set/ProductManifest.json",
    "Assets/GenWorks/siroino-telescope-cuff-tailor-set/README.md",
    "Assets/GenWorks/siroino-telescope-cuff-tailor-set/Source/Blender/TelescopeCuffTailorSet.blend",
    "Assets/GenWorks/siroino-telescope-cuff-tailor-set/Models/TelescopeCuffTailorSet.fbx",
    "Assets/GenWorks/siroino-telescope-cuff-tailor-set/Prefab/TelescopeCuffTailorSet.prefab",
    "Assets/GenWorks/siroino-telescope-cuff-tailor-set/Prefab/SiroinoSotai_TelescopeCuffTailorSet.prefab",
    "Assets/GenWorks/siroino-telescope-cuff-tailor-set/Previews/front.png",
    "Assets/GenWorks/siroino-telescope-cuff-tailor-set/Previews/back.png",
    "Assets/GenWorks/siroino-telescope-cuff-tailor-set/Previews/left.png",
    "Assets/GenWorks/siroino-telescope-cuff-tailor-set/Previews/right.png",
    "Assets/GenWorks/siroino-telescope-cuff-tailor-set/Previews/three-quarter.png"
  ],
  "previewPaths": {
    "front": "Assets/GenWorks/siroino-telescope-cuff-tailor-set/Previews/front.png",
    "back": "Assets/GenWorks/siroino-telescope-cuff-tailor-set/Previews/back.png",
    "left": "Assets/GenWorks/siroino-telescope-cuff-tailor-set/Previews/left.png",
    "right": "Assets/GenWorks/siroino-telescope-cuff-tailor-set/Previews/right.png",
    "three-quarter": "Assets/GenWorks/siroino-telescope-cuff-tailor-set/Previews/three-quarter.png"
  },
  "humanEvidence": {
    "visual-review": "Assets/_Local/Evidence/siroino-telescope-cuff-tailor-set/visual-review.json",
    "pose-penetration-review": "Assets/_Local/Evidence/siroino-telescope-cuff-tailor-set/pose-penetration-review.json",
    "vrchat-runtime-review": "Assets/_Local/Evidence/siroino-telescope-cuff-tailor-set/vrchat-runtime-review.json"
  },
  "allowedExtraBones": [],
  "unityReady": {
    "minimumDistinctMaterials": 4,
    "materialRoles": [
      {"material": "MAT_Shell", "role": "fabric"},
      {"material": "MAT_Inner", "role": "fabric"},
      {"material": "MAT_Bottoms", "role": "fabric"},
      {"material": "MAT_Hero", "role": "trim"},
      {"material": "MAT_Accent", "role": "trim"}
    ]
  }
}
