{
  "schemaVersion": 2,
  "id": "siroino-cyber-kawaii-large",
  "productName": "Cyber Kawaii Layered Set for Siroino _Large",
  "adapterId": "siroino-v1.0-large",
  "buildRevision": "v6-large-fitted-skirt-silhouette-pattern-contract-1",
  "productRoot": "Assets/GenWorks/siroino-cyber-kawaii-large",
  "productManifestPath": "Assets/GenWorks/siroino-cyber-kawaii-large/ProductManifest.json",
  "buildScript": "tools/run_product_build.py",
  "productBuildScript": "tools/siroino_cyber_kawaii_shape_profile_build.py",
  "blendPath": "Assets/GenWorks/siroino-cyber-kawaii-large/Source/Blender/SiroinoCyberKawaii.blend",
  "fbxAssetPath": "Assets/GenWorks/siroino-cyber-kawaii-large/Models/SiroinoCyberKawaii.fbx",
  "prefabAssetPath": "Assets/GenWorks/siroino-cyber-kawaii-large/Prefab/SiroinoCyberKawaii.prefab",
  "integratedPrefabAssetPath": "Assets/GenWorks/siroino-cyber-kawaii-large/Prefab/SiroinoSotai_CyberKawaii.prefab",
  "targetAvatarAssetPath": "Assets/SiroinoWorks/SiroinoSotai/Prefab/SiroinoSotai_PC.prefab",
  "targetSourcePath": "Assets/SiroinoWorks/SiroinoSotai/FBX/SiroinoSotai_PC.fbx",
  "targetResolution": {
    "strategy": "repository-search",
    "profile": "Siroino _Large via official shape keys on SiroinoSotai_PC",
    "normalSizeFallbackAllowed": true,
    "searchRoots": ["Assets"],
    "excludePrefixes": ["Assets/GenWorks", "Assets/_Local/Jobs"],
    "prefab": {
      "extensions": [".prefab"],
      "includeRegex": "(?i)(siroino|sotai)",
      "profileRegex": "(?i)SiroinoSotai_PC\\.prefab$",
      "contentRegex": null,
      "preferredRegex": "(?i)SiroinoSotai_PC\\.prefab$"
    },
    "source": {
      "extensions": [".fbx"],
      "includeRegex": "(?i)(siroino|sotai)",
      "profileRegex": "(?i)SiroinoSotai_PC\\.fbx$",
      "fallbackNameRegex": "(?i)^SiroinoSotai_PC\\.fbx$",
      "preferredRegex": "(?i)SiroinoSotai_PC\\.fbx$"
    }
  },
  "bodyShapeProfile": {
    "All_L": 1.0,
    "Chest_L": 1.0,
    "Hips_01_L": 1.0,
    "UpperLeg_L": 1.0,
    "Breasts_L": 0.65
  },
  "garmentPipeline": {
    "patternContractPath": "Assets/GenWorks/siroino-cyber-kawaii-large/Source/Patterns/cyber-kawaii-skirt.pattern.json",
    "garmentCodeSource": "https://github.com/maria-korosteleva/GarmentCode",
    "garmentCodeOutputPath": "Assets/GenWorks/siroino-cyber-kawaii-large/Source/Patterns/GarmentCode/cyber_kawaii_skirt_specification.json",
    "zozoContactSolverSource": "https://github.com/st-tech/ppf-contact-solver",
    "zozoSolvedMeshPath": "Assets/GenWorks/siroino-cyber-kawaii-large/Source/Solver/cyber-kawaii-skirt-solved.obj",
    "zozoSolverReportPath": "Assets/GenWorks/siroino-cyber-kawaii-large/Evidence/Commercial/zozo-contact-solver.json",
    "materialMakerSource": "https://github.com/RodZill4/material-maker",
    "materialMakerSourceRoot": "Assets/GenWorks/siroino-cyber-kawaii-large/Source/Materials",
    "blenderVerification": "neutral, arms-up, arm-cross, crouch, sit, twist",
    "releaseRequiresGarmentCodeOutput": true,
    "releaseRequiresExternalSolver": true,
    "releaseRequiresEditablePtex": true
  },
  "licenseEvidence": "config/products/siroino-cyber-kawaii-large/license.json",
  "privateSourceRoots": ["Assets/_Local", "Assets/_Vendor"],
  "deliveryAssets": [
    "Assets/GenWorks/siroino-cyber-kawaii-large/ProductManifest.json",
    "Assets/GenWorks/siroino-cyber-kawaii-large/README.md",
    "Assets/GenWorks/siroino-cyber-kawaii-large/SOURCE_HASHES.txt",
    "Assets/GenWorks/siroino-cyber-kawaii-large/Source/Patterns/cyber-kawaii-skirt.pattern.json",
    "Assets/GenWorks/siroino-cyber-kawaii-large/Source/Blender/SiroinoCyberKawaii.blend",
    "Assets/GenWorks/siroino-cyber-kawaii-large/Models/SiroinoCyberKawaii.fbx",
    "Assets/GenWorks/siroino-cyber-kawaii-large/Models/SiroinoCyberKawaii.fbx.meta",
    "Assets/GenWorks/siroino-cyber-kawaii-large/Prefab/SiroinoCyberKawaii.prefab",
    "Assets/GenWorks/siroino-cyber-kawaii-large/Prefab/SiroinoCyberKawaii.prefab.meta",
    "Assets/GenWorks/siroino-cyber-kawaii-large/Prefab/SiroinoSotai_CyberKawaii.prefab",
    "Assets/GenWorks/siroino-cyber-kawaii-large/Prefab/SiroinoSotai_CyberKawaii.prefab.meta",
    "Assets/GenWorks/siroino-cyber-kawaii-large/Textures/white_fabric_albedo.png",
    "Assets/GenWorks/siroino-cyber-kawaii-large/Textures/white_fabric_normal.png",
    "Assets/GenWorks/siroino-cyber-kawaii-large/Textures/white_fabric_roughness.png",
    "Assets/GenWorks/siroino-cyber-kawaii-large/Textures/plaid_albedo.png",
    "Assets/GenWorks/siroino-cyber-kawaii-large/Textures/plaid_normal.png",
    "Assets/GenWorks/siroino-cyber-kawaii-large/Textures/plaid_roughness.png",
    "Assets/GenWorks/siroino-cyber-kawaii-large/Textures/pink_satin_albedo.png",
    "Assets/GenWorks/siroino-cyber-kawaii-large/Textures/pink_satin_normal.png",
    "Assets/GenWorks/siroino-cyber-kawaii-large/Textures/pink_satin_roughness.png",
    "Assets/GenWorks/siroino-cyber-kawaii-large/Previews/front.png",
    "Assets/GenWorks/siroino-cyber-kawaii-large/Previews/back.png",
    "Assets/GenWorks/siroino-cyber-kawaii-large/Previews/left.png",
    "Assets/GenWorks/siroino-cyber-kawaii-large/Previews/right.png",
    "Assets/GenWorks/siroino-cyber-kawaii-large/Previews/three-quarter.png",
    "Assets/GenWorks/siroino-cyber-kawaii-large/Previews/Poses/neutral.png",
    "Assets/GenWorks/siroino-cyber-kawaii-large/Previews/Poses/arms-up.png",
    "Assets/GenWorks/siroino-cyber-kawaii-large/Previews/Poses/arm-cross.png",
    "Assets/GenWorks/siroino-cyber-kawaii-large/Previews/Poses/crouch.png",
    "Assets/GenWorks/siroino-cyber-kawaii-large/Previews/Poses/sit.png",
    "Assets/GenWorks/siroino-cyber-kawaii-large/Previews/Poses/prone.png",
    "Assets/GenWorks/siroino-cyber-kawaii-large/Previews/siroino-cyber-kawaii-large-multiview.webp",
    "Assets/GenWorks/siroino-cyber-kawaii-large/Previews/siroino-cyber-kawaii-large-pose-review.webp"
  ],
  "previewPaths": {
    "front": "Assets/GenWorks/siroino-cyber-kawaii-large/Previews/front.png",
    "back": "Assets/GenWorks/siroino-cyber-kawaii-large/Previews/back.png",
    "left": "Assets/GenWorks/siroino-cyber-kawaii-large/Previews/left.png",
    "right": "Assets/GenWorks/siroino-cyber-kawaii-large/Previews/right.png",
    "three-quarter": "Assets/GenWorks/siroino-cyber-kawaii-large/Previews/three-quarter.png"
  },
  "humanEvidence": {
    "visual-review": "Assets/_Local/Evidence/siroino-cyber-kawaii-large/visual-review.json",
    "pose-penetration-review": "Assets/_Local/Evidence/siroino-cyber-kawaii-large/pose-penetration-review.json",
    "vrchat-runtime-review": "Assets/_Local/Evidence/siroino-cyber-kawaii-large/vrchat-runtime-review.json"
  },
  "allowedExtraBones": []
}
