{
  "schemaVersion": 2,
  "renderLoopRevision": "v1-generic-structural",
  "id": "siroino-ribcage-vent-vest-set",
  "productName": "Ribcage Vent Vest Set",
  "adapterId": "siroino-v1.0",
  "productRoot": "Assets/GenWorks/siroino-ribcage-vent-vest-set",
  "productManifestPath": "Assets/GenWorks/siroino-ribcage-vent-vest-set/ProductManifest.json",
  "buildScript": "tools/run_product_build.py",
  "productBuildScript": "tools/generic_structural_garment_product.py",
  "hostedPoseScript": "tools/siroino_required_pose_render_entry.py",
  "blendPath": "Assets/GenWorks/siroino-ribcage-vent-vest-set/Source/Blender/RibcageVentVestSet.blend",
  "fbxAssetPath": "Assets/GenWorks/siroino-ribcage-vent-vest-set/Models/RibcageVentVestSet.fbx",
  "prefabAssetPath": "Assets/GenWorks/siroino-ribcage-vent-vest-set/Prefab/RibcageVentVestSet.prefab",
  "integratedPrefabAssetPath": "Assets/GenWorks/siroino-ribcage-vent-vest-set/Prefab/SiroinoSotai_RibcageVentVestSet.prefab",
  "targetAvatarAssetPath": "Assets/SiroinoWorks/SiroinoSotai/Prefab/SiroinoSotai_PC.prefab",
  "targetSourcePath": "Assets/SiroinoWorks/SiroinoSotai/FBX/SiroinoSotai_PC.fbx",
  "licenseEvidence": "config/products/siroino-ribcage-vent-vest-set/license.json",
  "privateSourceRoots": ["Assets/_Local", "Assets/_Vendor", "Assets/SiroinoWorks"],
  "deliveryAssets": ["Assets/GenWorks/siroino-ribcage-vent-vest-set/ProductManifest.json","Assets/GenWorks/siroino-ribcage-vent-vest-set/README.md","Assets/GenWorks/siroino-ribcage-vent-vest-set/Source/Blender/RibcageVentVestSet.blend","Assets/GenWorks/siroino-ribcage-vent-vest-set/Models/RibcageVentVestSet.fbx","Assets/GenWorks/siroino-ribcage-vent-vest-set/Prefab/RibcageVentVestSet.prefab","Assets/GenWorks/siroino-ribcage-vent-vest-set/Prefab/SiroinoSotai_RibcageVentVestSet.prefab","Assets/GenWorks/siroino-ribcage-vent-vest-set/Previews/front.png","Assets/GenWorks/siroino-ribcage-vent-vest-set/Previews/back.png","Assets/GenWorks/siroino-ribcage-vent-vest-set/Previews/left.png","Assets/GenWorks/siroino-ribcage-vent-vest-set/Previews/right.png","Assets/GenWorks/siroino-ribcage-vent-vest-set/Previews/three-quarter.png"],
  "previewPaths": {"front":"Assets/GenWorks/siroino-ribcage-vent-vest-set/Previews/front.png","back":"Assets/GenWorks/siroino-ribcage-vent-vest-set/Previews/back.png","left":"Assets/GenWorks/siroino-ribcage-vent-vest-set/Previews/left.png","right":"Assets/GenWorks/siroino-ribcage-vent-vest-set/Previews/right.png","three-quarter":"Assets/GenWorks/siroino-ribcage-vent-vest-set/Previews/three-quarter.png"},
  "humanEvidence": {"visual-review":"Assets/_Local/Evidence/siroino-ribcage-vent-vest-set/visual-review.json","pose-penetration-review":"Assets/_Local/Evidence/siroino-ribcage-vent-vest-set/pose-penetration-review.json","vrchat-runtime-review":"Assets/_Local/Evidence/siroino-ribcage-vent-vest-set/vrchat-runtime-review.json"},
  "allowedExtraBones": [],
  "unityReady": {"minimumDistinctMaterials":4,"materialRoles":[{"material":"MAT_Shell","role":"fabric"},{"material":"MAT_Inner","role":"fabric"},{"material":"MAT_Bottoms","role":"fabric"},{"material":"MAT_Hero","role":"trim"},{"material":"MAT_Accent","role":"trim"}]}
}
