{
  "schemaVersion": 2,
  "id": "siroino-harbor-signalist-uniform",
  "productName": "Harbor Signalist Uniform for Siroino",
  "adapterId": "siroino-v1.0-large",
  "automaticBuild": false,
  "buildCapability": "canonical-resumable-reference-pipeline",
  "buildRevision": "v1-harbor-signalist-reference-draft",
  "renderLoopRevision": "v1-five-view-six-pose",
  "productRoot": "Assets/GenWorks/siroino-harbor-signalist-uniform",
  "productManifestPath": "Assets/GenWorks/siroino-harbor-signalist-uniform/ProductManifest.json",
  "buildScript": "tools/siroino_harbor_signalist_uniform_build.py",
  "productBuildScript": "tools/siroino_harbor_signalist_uniform_build.py",
  "blendPath": "Assets/GenWorks/siroino-harbor-signalist-uniform/Source/Blender/SiroinoHarborSignalistUniform.blend",
  "fbxAssetPath": "Assets/GenWorks/siroino-harbor-signalist-uniform/Models/SiroinoHarborSignalistUniform.fbx",
  "prefabAssetPath": "Assets/GenWorks/siroino-harbor-signalist-uniform/Prefab/SiroinoHarborSignalistUniform.prefab",
  "integratedPrefabAssetPath": "Assets/GenWorks/siroino-harbor-signalist-uniform/Prefab/SiroinoSotai_HarborSignalistUniform.prefab",
  "targetAvatarAssetPath": "Assets/SiroinoWorks/SiroinoSotai/Prefab/SiroinoSotai_PC.prefab",
  "targetSourcePath": "Assets/SiroinoWorks/SiroinoSotai/FBX/SiroinoSotai_PC.fbx",
  "targetResolution": {
    "strategy": "repository-search",
    "profile": "Siroino _Large via official shape keys on SiroinoSotai_PC",
    "normalSizeFallbackAllowed": false,
    "searchRoots": ["Assets"],
    "excludePrefixes": ["Assets/GenWorks", "Assets/_Local/Jobs"]
  },
  "bodyShapeProfile": {
    "All_L": 1.0,
    "Chest_L": 1.0,
    "Hips_01_L": 1.0,
    "UpperLeg_L": 1.0,
    "Breasts_L": 0.65
  },
  "garmentPipeline": {
    "stageContractVersion": 2,
    "identityManifestPath": "config/products/siroino-harbor-signalist-uniform/reference-identity.json",
    "referenceAuditPath": "config/products/siroino-harbor-signalist-uniform/reference-audit.json",
    "privateReferencePath": "Assets/_Local/ReferenceImages/siroino-harbor-signalist-uniform.png",
    "decompositionPath": "config/products/siroino-harbor-signalist-uniform/garment-decomposition.json",
    "patternContractPath": "config/products/siroino-harbor-signalist-uniform/pattern-draft.json",
    "stitchGraphPath": "config/products/siroino-harbor-signalist-uniform/stitch-graph.json",
    "visualReviewPath": "config/products/siroino-harbor-signalist-uniform/visual-review.json",
    "constructionPath": "config/products/siroino-harbor-signalist-uniform/construction.json",
    "materialRecipePath": "config/products/siroino-harbor-signalist-uniform/material-recipe.json",
    "garmentcodeStitchExport": "strict-boundary-edges",
    "blenderVerification": "neutral, arms-up, arm-cross, crouch, sit, prone",
    "releaseRequiresEditableSource": true,
    "releaseRequiresFiveViews": true,
    "releaseRequiresPoseEvidence": true,
    "clothSimulation": {
      "applicability": "REQUIRED",
      "components": ["Harbor_Culotte_Left", "Harbor_Culotte_Right"],
      "evidence": "Assets/GenWorks/siroino-harbor-signalist-uniform/Evidence/Build/cloth-simulation.json",
      "reason": "The pleated wide-leg culottes need a measured cloth settlement against the target avatar before fit can be accepted."
    }
  },
  "researchMethod": {
    "name": "panel-first two-piece uniform reconstruction with GarmentCode stitch-pair exchange",
    "trialStatus": "DECLARED",
    "primaryEvidence": "config/products/siroino-harbor-signalist-uniform/pattern-draft.json",
    "secondaryEvidence": "config/products/siroino-harbor-signalist-uniform/stitch-graph.json"
  },
  "licenseEvidence": "config/products/siroino-harbor-signalist-uniform/license.json",
  "privateSourceRoots": ["Assets/_Local"],
  "patternLayoutPath": "Assets/GenWorks/siroino-harbor-signalist-uniform/Previews/pattern-layout.png",
  "previewPaths": {
    "front": "Assets/GenWorks/siroino-harbor-signalist-uniform/Previews/front.png",
    "back": "Assets/GenWorks/siroino-harbor-signalist-uniform/Previews/back.png",
    "left": "Assets/GenWorks/siroino-harbor-signalist-uniform/Previews/left.png",
    "right": "Assets/GenWorks/siroino-harbor-signalist-uniform/Previews/right.png",
    "three-quarter": "Assets/GenWorks/siroino-harbor-signalist-uniform/Previews/three-quarter.png"
  },
  "posePaths": {
    "neutral": "Assets/GenWorks/siroino-harbor-signalist-uniform/Previews/Poses/neutral.png",
    "arms-up": "Assets/GenWorks/siroino-harbor-signalist-uniform/Previews/Poses/arms-up.png",
    "arm-cross": "Assets/GenWorks/siroino-harbor-signalist-uniform/Previews/Poses/arm-cross.png",
    "crouch": "Assets/GenWorks/siroino-harbor-signalist-uniform/Previews/Poses/crouch.png",
    "sit": "Assets/GenWorks/siroino-harbor-signalist-uniform/Previews/Poses/sit.png",
    "prone": "Assets/GenWorks/siroino-harbor-signalist-uniform/Previews/Poses/prone.png"
  },
  "humanEvidence": {
    "visual-review": "Assets/_Local/Evidence/siroino-harbor-signalist-uniform/visual-review.json",
    "pose-penetration-review": "Assets/_Local/Evidence/siroino-harbor-signalist-uniform/pose-penetration-review.json",
    "vrchat-runtime-review": "Assets/_Local/Evidence/siroino-harbor-signalist-uniform/vrchat-runtime-review.json"
  },
  "allowedExtraBones": [],
  "deliveryAssets": [
    "Assets/GenWorks/siroino-harbor-signalist-uniform/ProductManifest.json",
    "Assets/GenWorks/siroino-harbor-signalist-uniform/README.md",
    "Assets/GenWorks/siroino-harbor-signalist-uniform/SOURCE_HASHES.txt",
    "Assets/GenWorks/siroino-harbor-signalist-uniform/Source/Patterns/harbor-signalist.pattern.json",
    "Assets/GenWorks/siroino-harbor-signalist-uniform/Source/Patterns/harbor-signalist.stitches.json",
    "Assets/GenWorks/siroino-harbor-signalist-uniform/Source/Blender/SiroinoHarborSignalistUniform.blend",
    "Assets/GenWorks/siroino-harbor-signalist-uniform/Models/SiroinoHarborSignalistUniform.fbx",
    "Assets/GenWorks/siroino-harbor-signalist-uniform/Prefab/SiroinoHarborSignalistUniform.prefab",
    "Assets/GenWorks/siroino-harbor-signalist-uniform/Prefab/SiroinoSotai_HarborSignalistUniform.prefab",
    "Assets/GenWorks/siroino-harbor-signalist-uniform/Previews/pattern-layout.png",
    "Assets/GenWorks/siroino-harbor-signalist-uniform/Previews/front.png",
    "Assets/GenWorks/siroino-harbor-signalist-uniform/Previews/back.png",
    "Assets/GenWorks/siroino-harbor-signalist-uniform/Previews/left.png",
    "Assets/GenWorks/siroino-harbor-signalist-uniform/Previews/right.png",
    "Assets/GenWorks/siroino-harbor-signalist-uniform/Previews/three-quarter.png",
    "Assets/GenWorks/siroino-harbor-signalist-uniform/Evidence/Build/product-build-report.json",
    "Assets/GenWorks/siroino-harbor-signalist-uniform/Evidence/Build/cloth-simulation.json"
  ]
}
